{
 "schema": "publish/1",
 "title": "What Happens When 100 Geniuses Are Trapped in the Stone Age?",
 "description": "What happens to the 100 greatest scientists in history if they wake up in the Stone Age? We follow Franklin, Newton, Einstein, Curie, Darwin, Snow, Nansen, Wallace and Tesla for a day, a week, a month, a year, ten years and a hundred years, then check the story against the real record: would knowledge alone have beaten history?\n\nThe people are real; what they say and do here is our invention. The science, dates and numbers are real and sourced (claim map in the project).",
 "chapters": [
  {
   "t": "0:00",
   "title": "Day 1"
  },
  {
   "t": "4:13",
   "title": "Week 1"
  },
  {
   "t": "8:18",
   "title": "Month 1"
  },
  {
   "t": "10:29",
   "title": "Year 1"
  },
  {
   "t": "13:39",
   "title": "Year 10"
  },
  {
   "t": "16:00",
   "title": "Year 100"
  },
  {
   "t": "17:13",
   "title": "Did they beat real history?"
  }
 ],
 "audience": "not_made_for_kids",
 "disclosure": {
  "decision": "disclose",
  "reason": "metadata.md: invented scenes with real historical figures, synthetic voice (the creator's conservative choice)",
  "photoreal_pictures": false,
  "ai_music_main": false
 },
 "mid_roll": "off",
 "self_certification_answered": false,
 "approval": null
}
